file_name,transcript,duration
-1048072287253840944.wav, Wie ist das Wetter?,1.1362020000233315
-1356008374084030485.wav, The bottom is this.,0.7280282999854535
-1721791279923706343.wav, Nächster Glied,0.7467033000430092
-1804266037657434956.wav, Schalten die Schreibtisch Lampere an.,0.8578672000439838
-1989279303727964264.wav,さあ今つは徨く文字だねちょー!動画аласьがねぇ Mary,3.881121799990069
-2254295960242588415.wav, And promises,2.5116413000505418
-2356375025016486621.wav, magn 물론 gem realizing,4.881955400051083
-2650545123439545563.wav," Spieler, meine Playlist, gut weibst.",0.8323032000334933
-2885922673739509265.wav, Spielem Musik von George S. Rahn.,0.8028277999837883
-3054160188261298530.wav, The bottom is this,0.6865352999884635
-3140345446509399723.wav, Schalt sich schreibtisch lang für An.,0.7918842999497429
-3255535706884190802.wav, The badmouth does,2.625617100042291
-3260110239883201105.wav, Scheinte die Naselampe aus.,0.8506723999744281
-3458784527839994859.wav, Sie sollen das staffing werden!,2.87621560000116
-3505675475793140759.wav, Meستatministerian,2.8912664000527
-3628841099932294804.wav, Stop.,0.6767248000251129
-3720632875834678692.wav," Vod must definitely cherish this. Our recent videos, week in October will dochures the same world sharing Lauren with Sicho's representative Richard Mecharins who will conduct a video with W 스텐",3.652848099998664
-3816373869755305672.wav, Spiele Musik von George S.R.,0.7781663000350818
-3915647696684559715.wav, Spiele Tom Misch,1.1179146000067703
-3919755180620350935.wav, My Mom is First,2.6914128999924287
-4114479011575402682.wav,现在白环汇酸孤门的接早,4.12596289999783
-4365617956290164931.wav, Stop,0.6350384000106715
-4382517413666015129.wav,,4.973227099981159
-4664780067108594103.wav, Lautstärke 50 Prozent,0.7376091000041924
-5427852797491776973.wav, A Lot A Lotika,11.337256000027992
-5627124473825586219.wav, We bomb is this,0.6805426999926567
-57146584618704176.wav," Nachte Hell,'T记apon?",2.792161799967289
-6295370598187156927.wav, Spiele Musik von George S.A.,0.7888844999833964
-6395150946001331075.wav, Stelle ein Timer auf 3 Minuten,0.8156214999617077
-6418406677255623409.wav, How's it going? Comment which ones are called regionalлавian. Fundress,5.168496199999936
-6864977951898798107.wav, The bomb is this,0.7220736999879591
-6945221211508557363.wav, weiter.,2.4785818999516778
-7155928024945667670.wav, Spiel im Musik von George Ezra.,0.790585300012026
-7229002595491170769.wav, V Provost us,2.540851700003259
-7252711668098592248.wav, Would ich meine und der hat ja YLT... N Stresslag. Ja.acht2019,4.143854199966881
-7443419035393087802.wav, The bomb is just...,0.7140217999694869
-781029990973593338.wav, Spielu Music from George Ezra,0.7605784999905154
-7939437697514526047.wav, Das muss man so der neuron eigenheit하�tem mal beisektizates um damit aufh registered.,4.401762199995574
-8065899717403272559.wav, Schalten die Schreibtisch Lampere an.,0.826614499965217
-8307350171193249867.wav, Wie war es das?,0.6915273999911733
-8335639914664763388.wav, Da wir Gavin Fizen go ausxes poquito Sinn haben.,3.549482799950056
-8649899826203028995.wav, Mizaldasın tak distancing,3.0467739999876358
-8662109648862597665.wav, Wie soll das Wetter morgen werden?,0.8117254999815486
-908364769289161658.wav, Stelle einen Timer auf einem Lute.,0.8078756000031717
-9104485477497906919.wav, The bottom is this.,0.7467585999984294
-9219321921546923899.wav, Next up!,0.692998600017745
-929089241157026089.wav," Who, 만�list News?",2.723686599987559
1335384650698003817.wav, Scheiße das nicht aus.,0.7388284999760799
1374573672542296298.wav, Speer and muziek from George S.R.,1.3896295999875292
1833840819915314940.wav, Schaltet das Licht an.,0.7155513999750838
1966185051758695485.wav, stop,0.6583861000253819
2188972486889499368.wav, The bottom is this.,0.7044841999886557
2274781927739465012.wav, Schaltet die Schreibtisch nach dem Voraus.,1.34890829998767
2586052084078713988.wav, We've all done sweat up there.,0.7875632999930531
2624689785381335944.wav,,7.701381599996239
2881523674983819536.wav, Weiche Temperatur haben wir,1.2179409000091255
2916361586207181553.wav, Stop,0.6419329000054859
2986317971933442551.wav, Scheiße das Licht aus.,0.732919700036291
3262439443875331043.wav, Stop.,0.6748473000479862
3640707785575690295.wav, muss derIGH0 markiert vielleicht europ Dieses ran por,3.172997799993027
3902190776610544951.wav, A Nouience Shop,2.4322034000069834
3915342670113925279.wav,,0.6792253999738023
4111649670161357313.wav, Mach ihr die Schreibtisch Lamperella.,0.8603197000338696
4157860984905643438.wav, Neville must.,2.9040932999923825
4297305495353333258.wav, Schreibt die Schreibtischnampe und die Leselampe aus.,0.988299599965103
430710197275474663.wav," das ist wirklich echt echte Ipsdr.. ja, ich finde es.. also du..",4.7740496000042185
4675182390853274760.wav, the bomb,2.8645707999821752
5115702181349197496.wav,,0.660450600029435
5384311615813345395.wav, The bomb is this.,0.750222800008487
5610610031047761799.wav, Weiter!,0.6737002999871038
5843144413122326437.wav, Schaltet die Schreibtisch Lampen her aus.,0.8580337999737822
5844629325737184626.wav, Stop.,0.6710478000459261
5951917220811449639.wav, Stelle ein Time auf 2 Minuten,0.7662868000334129
5971536822972356971.wav, Next is neat,0.669255200016778
6088370699404778503.wav, We back on this this,0.715083200018853
6188726337220268386.wav, in these bar manifestors,3.0732701000524685
6431265506843456988.wav, Schalten die Schreibtisch Lampere aus.,1.3348871999769472
6597993263760585011.wav, Stop.,0.7166466999915428
6664138523960726010.wav, Spielen meine Playlist work out.,0.7555804000003263
6802470049658644978.wav, Nächstes Lied,2.733141400036402
6926645521162084341.wav," Spíllő, resemblean csajj assban",3.6461068999487907
6986889402278993051.wav, Schaltet die schreibtisch lampbe aus,1.2544742999598384
7052143873203634884.wav, Wie warm ist du es draußen?,0.7501162000116892
7083240311905493680.wav, Schreibt die Schreibt des Lampern.,0.8411265999893658
7091800334075908445.wav,,4.509073699999135
7310200299914494569.wav, Wie warm ist das?,0.6963825999991968
735527555483722974.wav,,0.7829363999771886
7680640145764897002.wav, Schalten die Schreibtisch landen wir aus,0.8013024000101723
7801294207611410434.wav," Okay, jetzt haben wir schon. Außen.",0.840253800037317
7870915523432461361.wav, Stop.,0.6596066000056453
7978985906274968365.wav, hey.,2.7918077999493107
7984620597920634445.wav, Aber meinewanne متackekte Hello! Aber Sie vergem 천 Fans.,4.453708000015467
8096478510743381349.wav, weiter,0.7905462000053376
8145229645944103541.wav, Wie soll das weiter werden?,0.9632023999583907
8290046914643000611.wav, Spiel im Musik von George S.B.,0.8514083999907598
8434788237000945914.wav, Romance as fatal,3.520760900049936
8652738717293724797.wav, We promised us,0.981825899973046
8718191935873709757.wav, Schaltet die Schreibtischlampen an.,0.9543747000279836
8831544086666500354.wav, Schaltet die Schreibtisch lang über aus,0.9287198000238277
8884734985583247604.wav, Next time,0.7828266000142321
9115564353508009885.wav, Wie soll das mit dem Morgen werden?,0.9137820000178181
